[
  {
    "EO_ID": "EO-DOEInspector-MONSOON-SLOPE-EXCAVATION-000000-001",
    "Origin_Source": "SRC-EIA-PENANG-001",
    "Direct_Observation": "Intense tropical monsoon precipitation exceeded fifty millimeters per hour across the exposed earthworks during site platform preparation and cut slope excavation operations today. Uncontrolled surface runoff velocity accelerated rill erosion along the unprotected twenty-eight degree cut slopes near the northern perimeter boundary and perimeter diversion drain.",
    "Context_Anchor": "Media timecode [0.0s - 32.5s] | Verified WPM: 84.9",
    "Start_Sec": 0.0,
    "End_Sec": 32.5,
    "Duration_Sec": 32.5,
    "Word_Count": 46,
    "Speech_Rate_WPM": 84.9,
    "Span_SHA256": "443c62a87390c27dca373bb919fc1ccda04fd539ec82d3ffadae7a4cbff7508c",
    "Linked_IO": "IO-TX-BENCHMARK-ENV-001-001",
    "Confidence": 0.85,
    "Status": "CANDIDATE",
    "Human_Approval_State": "PENDING_LEVEL_5_REVIEW",
    "Canonical_Status": "NOT_APPROVED",
    "Transaction_ID": "TX-BENCHMARK-ENV-001"
  },
  {
    "EO_ID": "EO-DOEInspector-SEDIMENT-BASIN-SPILLWAY-000032-002",
    "Origin_Source": "SRC-EIA-PENANG-001",
    "Direct_Observation": "The primary sediment retention basin overflowed through the emergency spillway as suspended sediment discharge surpassed two hundred milligrams per liter statutory limits across monitoring stations.",
    "Context_Anchor": "Media timecode [32.5s - 49.5s] | Verified WPM: 88.2",
    "Start_Sec": 32.5,
    "End_Sec": 49.5,
    "Duration_Sec": 17.0,
    "Word_Count": 25,
    "Speech_Rate_WPM": 88.2,
    "Span_SHA256": "3f943689847fb41556f7bcc78bada68f756c7d9c18e0f5c6c780ec87bbe520a8",
    "Linked_IO": "IO-TX-BENCHMARK-ENV-001-002",
    "Confidence": 0.85,
    "Status": "CANDIDATE",
    "Human_Approval_State": "PENDING_LEVEL_5_REVIEW",
    "Canonical_Status": "NOT_APPROVED",
    "Transaction_ID": "TX-BENCHMARK-ENV-001"
  },
  {
    "EO_ID": "EO-DOEInspector-WATER-TSS-TURBIDITY-000049-003",
    "Origin_Source": "SRC-EIA-PENANG-001",
    "Direct_Observation": "Downstream environmental water quality monitoring at station WQM-01 recorded severe statutory TSS exceedance and elevated turbidity across the receiving river channel outfall during peak flow.",
    "Context_Anchor": "Media timecode [49.5s - 66.5s] | Verified WPM: 88.2",
    "Start_Sec": 49.5,
    "End_Sec": 66.5,
    "Duration_Sec": 17.0,
    "Word_Count": 25,
    "Speech_Rate_WPM": 88.2,
    "Span_SHA256": "27342c6a2518575ae9a9a99538b92176660e783b60de7bf19b578a17aebbd17d",
    "Linked_IO": "IO-TX-BENCHMARK-ENV-001-003",
    "Confidence": 0.85,
    "Status": "CANDIDATE",
    "Human_Approval_State": "PENDING_LEVEL_5_REVIEW",
    "Canonical_Status": "NOT_APPROVED",
    "Transaction_ID": "TX-BENCHMARK-ENV-001"
  },
  {
    "EO_ID": "EO-DOEInspector-SILT-EFFLUENT-WEIR-000083-004",
    "Origin_Source": "SRC-EIA-PENANG-001",
    "Direct_Observation": "The tiered settlement compartment successfully retained heavy suspended silt particles while clean supernatant effluent discharged through the final baffle weir into downstream retention ponds.",
    "Context_Anchor": "Media timecode [83.5s - 100.5s] | Verified WPM: 84.7",
    "Start_Sec": 83.5,
    "End_Sec": 100.5,
    "Duration_Sec": 17.0,
    "Word_Count": 24,
    "Speech_Rate_WPM": 84.7,
    "Span_SHA256": "0bdd86121d7dd91f5128a161095257c1faa87c9e25ed44be1303397cd3a19505",
    "Linked_IO": "IO-TX-BENCHMARK-ENV-001-004",
    "Confidence": 0.85,
    "Status": "CANDIDATE",
    "Human_Approval_State": "PENDING_LEVEL_5_REVIEW",
    "Canonical_Status": "NOT_APPROVED",
    "Transaction_ID": "TX-BENCHMARK-ENV-001"
  },
  {
    "EO_ID": "EO-DOEInspector-ERODIBILITY-MONSOON-000100-005",
    "Origin_Source": "SRC-EIA-PENANG-001",
    "Direct_Observation": "Saturated soil erodibility tests confirmed that local granite residual soil possesses high wash-off potential during prolonged tropical monsoon downpours across untreated earthwork surfaces.",
    "Context_Anchor": "Media timecode [100.5s - 117.5s] | Verified WPM: 81.2",
    "Start_Sec": 100.5,
    "End_Sec": 117.5,
    "Duration_Sec": 17.0,
    "Word_Count": 23,
    "Speech_Rate_WPM": 81.2,
    "Span_SHA256": "5e84e13abd431b81628ba189d8b57bec17007b0fbd2cdaf3ffbcb122b309b063",
    "Linked_IO": "IO-TX-BENCHMARK-ENV-001-005",
    "Confidence": 0.85,
    "Status": "CANDIDATE",
    "Human_Approval_State": "PENDING_LEVEL_5_REVIEW",
    "Canonical_Status": "NOT_APPROVED",
    "Transaction_ID": "TX-BENCHMARK-ENV-001"
  }
]