[
  {
    "EO_ID": "EO-LeadResearcher-SENSOR-CALIBRATION-VARIANCE-000000-001",
    "Origin_Source": "SRC-SCI-ARTICLE-001",
    "Direct_Observation": "Controlled laboratory experiments were conducted to evaluate semiconductor sensor calibration variance under thermal stress. Baseline temperature sweeps demonstrated that ambient sensor drift correlated directly with junction power dissipation during continuous operation.",
    "Context_Anchor": "Media timecode [0.0s - 16.0s] | Verified WPM: 116.2",
    "Start_Sec": 0.0,
    "End_Sec": 16.0,
    "Duration_Sec": 16.0,
    "Word_Count": 31,
    "Speech_Rate_WPM": 116.2,
    "Span_SHA256": "b56e3a40e8484a0b00543b20909aec85b5faaeb54570afe5d08fb1ac74929214",
    "Linked_IO": "IO-TX-BENCHMARK-SCI-001-001",
    "Confidence": 0.85,
    "Status": "CANDIDATE",
    "Human_Approval_State": "PENDING_LEVEL_5_REVIEW",
    "Canonical_Status": "NOT_APPROVED",
    "Transaction_ID": "TX-BENCHMARK-SCI-001"
  },
  {
    "EO_ID": "EO-LeadResearcher-MEASUREMENT-STATISTICAL-SENSOR-000017-002",
    "Origin_Source": "SRC-SCI-ARTICLE-001",
    "Direct_Observation": "High precision measurement protocols recorded statistical divergence across uncompensated sensor detector channels exceeding five percent. Conversely, automated temperature compensation feedback circuits effectively suppressed thermal drift and stabilized telemetry output.",
    "Context_Anchor": "Media timecode [17.5s - 33.5s] | Verified WPM: 108.8",
    "Start_Sec": 17.5,
    "End_Sec": 33.5,
    "Duration_Sec": 16.0,
    "Word_Count": 29,
    "Speech_Rate_WPM": 108.8,
    "Span_SHA256": "aea251f2bd6e420548b96b2a2e5c6d29a9174e42f752742c1589abb3469d8186",
    "Linked_IO": "IO-TX-BENCHMARK-SCI-001-002",
    "Confidence": 0.85,
    "Status": "CANDIDATE",
    "Human_Approval_State": "PENDING_LEVEL_5_REVIEW",
    "Canonical_Status": "NOT_APPROVED",
    "Transaction_ID": "TX-BENCHMARK-SCI-001"
  },
  {
    "EO_ID": "EO-LeadResearcher-CALIBRATION-ERROR-MEASUREMENT-000035-003",
    "Origin_Source": "SRC-SCI-ARTICLE-001",
    "Direct_Observation": "Independent experimental replications confirmed that physical dielectric relaxation induces measurable phase noise across high frequency trials. Calibration error analysis indicated that systematic measurement bias can be mitigated through multi-station reference detector cross-validation.",
    "Context_Anchor": "Media timecode [35.0s - 51.0s] | Verified WPM: 120.0",
    "Start_Sec": 35.0,
    "End_Sec": 51.0,
    "Duration_Sec": 16.0,
    "Word_Count": 32,
    "Speech_Rate_WPM": 120.0,
    "Span_SHA256": "1effae62e827580fe25d3ea55b8494733344248f182ee992a644d77f8230f8f8",
    "Linked_IO": "IO-TX-BENCHMARK-SCI-001-003",
    "Confidence": 0.85,
    "Status": "CANDIDATE",
    "Human_Approval_State": "PENDING_LEVEL_5_REVIEW",
    "Canonical_Status": "NOT_APPROVED",
    "Transaction_ID": "TX-BENCHMARK-SCI-001"
  },
  {
    "EO_ID": "EO-LeadResearcher-EMPIRICAL-VARIANCE-ERROR-000052-004",
    "Origin_Source": "SRC-SCI-ARTICLE-001",
    "Direct_Observation": "Empirical state manipulation produced statistically significant response curves validating the primary physical transport model. The observed covariate variance remained fully bounded within theoretical experimental error distributions throughout the ninety minute trial.",
    "Context_Anchor": "Media timecode [52.5s - 68.5s] | Verified WPM: 116.2",
    "Start_Sec": 52.5,
    "End_Sec": 68.5,
    "Duration_Sec": 16.0,
    "Word_Count": 31,
    "Speech_Rate_WPM": 116.2,
    "Span_SHA256": "e4e9b6aa08e7fd27ef34a2770b94dd2d24f2e242708439afa65ca5835332b500",
    "Linked_IO": "IO-TX-BENCHMARK-SCI-001-004",
    "Confidence": 0.85,
    "Status": "CANDIDATE",
    "Human_Approval_State": "PENDING_LEVEL_5_REVIEW",
    "Canonical_Status": "NOT_APPROVED",
    "Transaction_ID": "TX-BENCHMARK-SCI-001"
  }
]